{
  "event_id": "00000000-0000-4000-8000-000000000008",
  "task_id": "00000000-0000-4000-8000-000000000001",
  "seq": 3,
  "kind": "finished",
  "at": 1735689600110,
  "payload": {
    "status": "SUCCEEDED",
    "exit_code": 0,
    "reason": null,
    "audit_complete": true,
    "stdout": {
      "sha256": "e3b0c44298fc1c149afbf4c8996fb92427ae41e4649b934ca495991b7852b855",
      "size": 0
    },
    "stderr": {
      "sha256": "e3b0c44298fc1c149afbf4c8996fb92427ae41e4649b934ca495991b7852b855",
      "size": 0
    },
    "started_at": 1735689600100,
    "finished_at": 1735689600110,
    "cleanup": "process_group"
  }
}
